{
  "$schema": "./kzo-244-acceptance-matrix.schema.json",
  "matrixVersion": "1.0.0",
  "ticket": "KZO-244",
  "title": "Taiwan Stock Research V1 acceptance and reference-subject matrix",
  "selectionVerifiedAt": "2026-08-27",
  "authoritativeCorpus": [
    { "id": "KZO-234", "kind": "linear_issue", "locator": "https://linear.app/kzokv/issue/KZO-234", "authority": "Destination, standing decisions, scope, and handoff boundary" },
    { "id": "KZO-235", "kind": "repository_artifact", "locator": "docs/004-notes/005-market-data/research-20260822-kzo235-market-data-reconciliation.md", "commit": "6d13607c", "authority": "Existing-platform reconciliation" },
    { "id": "KZO-236", "kind": "repository_artifact", "locator": "docs/research/kzo-236-authoritative-source-matrix.md", "commit": "43a81f7e", "authority": "Authoritative free-source routing" },
    { "id": "KZO-237", "kind": "linear_resolution", "locator": "https://linear.app/kzokv/issue/KZO-237", "authority": "Canonical research data model and provenance envelope" },
    { "id": "KZO-238", "kind": "linear_resolution", "locator": "https://linear.app/kzokv/issue/KZO-238", "authority": "Freshness, completeness, reconciliation, and withholding" },
    { "id": "KZO-239", "kind": "linear_resolution", "locator": "https://linear.app/kzokv/issue/KZO-239", "authority": "Read-only MCP surface and contract boundaries" },
    { "id": "KZO-240", "kind": "linear_resolution", "locator": "https://linear.app/kzokv/issue/KZO-240", "authority": "Research report and Skill orchestration contract" },
    { "id": "KZO-241", "kind": "linear_resolution", "locator": "https://linear.app/kzokv/issue/KZO-241", "authority": "Valuation and scenario semantics" },
    { "id": "KZO-242", "kind": "linear_resolution", "locator": "https://linear.app/kzokv/issue/KZO-242", "authority": "Portfolio overlay and implication semantics" },
    { "id": "KZO-243", "kind": "linear_resolution", "locator": "https://linear.app/kzokv/issue/KZO-243", "authority": "Rollout, coexistence, observability, and rollback" },
    { "id": "KZO-244", "kind": "linear_issue", "locator": "https://linear.app/kzokv/issue/KZO-244", "authority": "Acceptance gates, evidence, reference subjects, and handoff" }
  ],
  "gates": [
    { "id": "G1", "name": "Specification handoff", "purpose": "Prove that the V1 specification is complete, internally consistent, source-faithful, and implementable.", "completionRule": "All G1 cases pass; decision-level TBDs and contradictions are zero; implementation-only deferrals are bounded and owned." },
    { "id": "G2", "name": "Implementation conformance", "purpose": "Prove contracts, deterministic behavior, report composition, compatibility, privacy, and safety on implemented backends.", "completionRule": "All non-waivable G2 cases pass on their assigned backends and every permitted waiver satisfies the matrix policy." },
    { "id": "G3", "name": "Rollout readiness", "purpose": "Prove live source health, operational thresholds, coexistence, promotion evidence, and rollback safety.", "completionRule": "The KZO-243 phase evidence and every G3 acceptance manifest are complete and approved by the release and operations owners." }
  ],
  "baselineCutoffPolicy": "Capture primary real-subject evidence at one completed Taiwan trading-day cutoff after all mandatory daily datasets are due, then bind one knowledgeAt after applicable grace windows. Historical, filing-deadline, transfer, and lifecycle cases declare separate immutable cutoffs.",
  "fixturePolicy": {
    "requiredMetadata": ["publisher", "sourceLocation", "contentHash", "retrievedAt", "publishedAt", "effectiveAt", "knowledgeAt", "subjectIdentifiers", "rawRepresentation", "normalizedRepresentation", "contractVersions", "policyVersions"],
    "mutationRule": "Derive adverse fixtures from an authentic captured base with an explicit mutation recipe. Pure synthetic evidence is reserved for otherwise impossible contract states and is labelled synthetic.",
    "privateDataRule": "Portfolio fixtures are fully synthetic and contain no production-derived user identifiers or private facts.",
    "redistributionRule": "Retain a legally permitted artifact or excerpt. When redistribution is prohibited, retain the artifact in controlled storage and publish its hash and reproducible retrieval instructions."
  },
  "referenceSubjects": [
    {
      "role": "golden_twse",
      "primary": { "ticker": "2330", "venue": "TWSE", "name": "Taiwan Semiconductor Manufacturing Co., Ltd.", "instrumentType": "common_equity" },
      "fallback": { "ticker": "2454", "venue": "TWSE", "name": "MediaTek Inc.", "instrumentType": "common_equity" },
      "uniqueCoverage": ["TWSE operating-company golden path", "scenario earnings multiple", "complete mandatory evidence"],
      "validationPolicy": "Run the primary full case; smoke-check fallback identity, eligibility, routing, and required source availability at every rollout phase."
    },
    {
      "role": "golden_tpex",
      "primary": { "ticker": "5274", "venue": "TPEX", "name": "ASPEED Technology Inc.", "instrumentType": "common_equity" },
      "fallback": { "ticker": "8299", "venue": "TPEX", "name": "Phison Electronics Corp.", "instrumentType": "common_equity" },
      "uniqueCoverage": ["TPEx operating-company golden path", "board-specific source routing", "complete mandatory evidence"],
      "validationPolicy": "Run the primary full case; smoke-check fallback identity, eligibility, routing, and required source availability at every rollout phase."
    },
    {
      "role": "etf_limited",
      "primary": { "ticker": "0050", "venue": "TWSE", "name": "Yuanta/P-shares Taiwan Top 50 ETF", "instrumentType": "etf", "notes": "Also anchors the real split lifecycle." },
      "fallback": { "ticker": "006208", "venue": "TWSE", "name": "Fubon FTSE TWSE Taiwan 50 ETF", "instrumentType": "etf" },
      "uniqueCoverage": ["ETF-limited report", "distributions", "portfolio context without action implications", "certificate split"],
      "validationPolicy": "Pin the effective Security rights and distribution lifecycle; never expand into operating-company or full ETF research."
    },
    {
      "role": "identity_only",
      "primary": { "ticker": "020032", "venue": "TWSE", "name": "Yuanta Green Energy ETN", "instrumentType": "etn" },
      "fallback": { "ticker": "020029", "venue": "TWSE", "name": "Yuanta ESG High Dividend ETN", "instrumentType": "etn" },
      "uniqueCoverage": ["identity-only routing", "unsupported instrument behavior"],
      "validationPolicy": "Confirm listing and expiry before each phase; fundamentals, valuation, and action semantics remain not applicable."
    },
    {
      "role": "cyclical_normalization",
      "primary": { "ticker": "2002", "venue": "TWSE", "name": "China Steel Corporation", "instrumentType": "common_equity" },
      "fallback": { "ticker": "2603", "venue": "TWSE", "name": "Evergreen Marine Corp. (Taiwan) Ltd.", "instrumentType": "common_equity" },
      "uniqueCoverage": ["mid-cycle normalization", "peak/trough treatment", "valid withholding when cycle support is inadequate"],
      "validationPolicy": "Use a pinned historical evidence bundle spanning an identifiable cycle; never rely on the current point in the cycle alone."
    },
    {
      "role": "unsupported_sector_valuation",
      "primary": { "ticker": "2881", "venue": "TWSE", "name": "Fubon Financial Holding Co., Ltd.", "instrumentType": "common_equity" },
      "fallback": { "ticker": "2882", "venue": "TWSE", "name": "Cathay Financial Holding Co., Ltd.", "instrumentType": "common_equity" },
      "uniqueCoverage": ["common-method unfit", "no improvised P/B, dividend-discount, excess-return, or liquidation method"],
      "validationPolicy": "A withheld fair value is the expected successful result unless every common-method gate genuinely passes."
    },
    {
      "role": "dcf_cross_check",
      "primary": { "ticker": "2412", "venue": "TWSE", "name": "Chunghwa Telecom Co., Ltd.", "instrumentType": "common_equity" },
      "fallback": { "ticker": "3045", "venue": "TWSE", "name": "Taiwan Mobile Co., Ltd.", "instrumentType": "common_equity" },
      "uniqueCoverage": ["FCFF DCF cross-check", "enterprise-to-equity bridge", "terminal-value and sensitivity gates"],
      "validationPolicy": "Use a real cross-check path. DCF-primary override remains a deterministic fixture unless a revalidated real snapshot satisfies the override."
    },
    {
      "role": "short_listing_history",
      "primary": { "ticker": "7811", "venue": "TPEX", "name": "Minson Integration, Inc.", "instrumentType": "common_equity", "notes": "TPEx listing date 2026-03-25." },
      "fallback": { "ticker": "7768", "venue": "TWSE", "name": "Praise Victor Industrial Co., Ltd.", "instrumentType": "common_equity", "notes": "TWSE listing date 2026-05-07." },
      "uniqueCoverage": ["insufficient post-listing history", "short point-in-time analysis", "history-dependent withholding"],
      "validationPolicy": "Preserve not-expected pre-listing ranges and never fabricate or automatically stitch predecessor history."
    },
    {
      "role": "venue_transfer",
      "primary": { "ticker": "5236", "venue": "TWSE", "name": "Sunplus Innovation Technology Inc.", "instrumentType": "common_equity", "notes": "Transferred from TPEx to TWSE on 2026-07-16." },
      "fallback": { "ticker": "6589", "venue": "TWSE", "name": "TaiMed Biologics Inc.", "instrumentType": "common_equity", "notes": "Transferred from TPEx to TWSE in 2025." },
      "uniqueCoverage": ["immutable Listing intervals", "predecessor/successor references", "no automatic history stitching"],
      "validationPolicy": "Pin both former and current Listing identities and exercise effective-time routing on both sides of the transfer."
    }
  ],
  "cases": [
    {